### ISSUE TITLE
Test API Features

### ISSUE THREAD

**Issue by prayanne** [Univ-3-2-Network/docker_Packet_around_Service#10]
# Test List
- wireshark-csv
- latest
- analysis
1. dns
2. http
3. tcp

#  check flow
1. wireshark-csv -> curl with file -> good response
2. latest -> check DB Healthy
3. put in files per analysis Features

**Comment by prayanne** [comment]
[in csv.csv](https://github.com/user-attachments/files/23440654/in.csv.csv)

```csv
"No.","Time","Source","Destination","Protocol","Length","Info"
"117","1.917693","192.168.1.132","192.168.1.201","TCP","74","50486  >  8088 [SYN] Seq=0 Win=64240 Len=0 MSS=1460 SACK_PERM TSval=492556600 TSecr=0 WS=128"
"118","1.917855","192.168.1.201","192.168.1.132","TCP","74","8088  >  50486 [SYN, ACK] Seq=0 Ack=1 Win=65535 Len=0 MSS=1460 WS=256 SACK_PERM TSval=862688175 TSecr=492556600"
"121","1.922023","192.168.1.132","192.168.1.201","TCP","66","50486  >  8088 [ACK] Seq=1 Ack=1 Win=64256 Len=0 TSval=492556618 TSecr=862688175"
"123","1.922023","192.168.1.132","192.168.1.201","TCP","289","50486  >  8088 [PSH, ACK] Seq=1 Ack=1 Win=64256 Len=223 TSval=492556618 TSecr=862688175 [TCP PDU reassembled in 124]"
"124","1.922023","192.168.1.132","192.168.1.201","HTTP","237","POST /api/net/ingest/wireshark-csv HTTP/1.1 "
"125","1.922093","192.168.1.201","192.168.1.132","TCP","66","8088  >  50486 [ACK] Seq=1 Ack=395 Win=2097664 Len=0 TSval=862688180 TSecr=492556618"
"126","1.927322","192.168.1.201","192.168.1.132","HTTP/JSON","356","HTTP/1.1 400  , JSON (application/json)"
"127","1.928322","192.168.1.132","192.168.1.201","TCP","66","50486  >  8088 [ACK] Seq=395 Ack=291 Win=64000 Len=0 TSval=492556628 TSecr=862688185"
"128","1.928905","192.168.1.132","192.168.1.201","TCP","66","50486  >  8088 [FIN, ACK] Seq=395 Ack=291 Win=64128 Len=0 TSval=492556628 TSecr=862688185"
"129","1.928933","192.168.1.201","192.168.1.132","TCP","66","8088  >  50486 [ACK] Seq=291 Ack=396 Win=2097664 Len=0 TSval=862688186 TSecr=492556628"
"130","1.929445","192.168.1.201","192.168.1.132","TCP","66","8088  >  50486 [FIN, ACK] Seq=291 Ack=396 Win=2097664 Len=0 TSval=862688187 TSecr=492556628"
"134","1.933859","192.168.1.132","192.168.1.201","TCP","66","50486  >  8088 [ACK] Seq=396 Ack=292 Win=64128 Len=0 TSval=492556633 TSecr=862688187"

```

**Comment by prayanne** [comment]
# solve error from curl file to api/net~wireshark-csv

- test other api path now
